2025-04-20T20:21:11.507502+00:00,PPLT,0.5731202080096828,The correlation between EV charger growth and the PPLT prices over the past 5 months is moderate. It suggests that there is some relationship between EV market expansion and this particular metals ETF's market performance. Investors might consider monitoring this trend for potential investment opportunities.
2025-04-23T12:20:04.125405+00:00,PPLT,0.8053317266825144,"A strong positive correlation suggests that as EV charger growth occurs, demand for metals in PPLT may rise, making it a potentially attractive investment as EV infrastructure expands."
2025-04-24T12:20:17.203175+00:00,PPLT,0.8434336570975602,Strong positive correlation suggests that increases in EV charger growth could be associated with rising PPLT prices. Consider monitoring the EV sector for investment opportunities in PPLT.
2025-04-25T12:19:42.503743+00:00,PPLT,0.8106175786844203,Strong positive correlation; consider monitoring PPLT for investments correlated with EV growth.
2025-04-26T12:17:44.246205+00:00,PPLT,-0.0665,"The correlation between EV charger growth and the metals ETF PPLT over the last 5 months is very low (-0.0665), suggesting nearly no linear relationship. There's no clear basis to adjust investment strategies for PPLT based on EV growth rates."
2025-04-27T12:17:49.082443+00:00,PPLT,0.2831469578123982,"With a low positive correlation of 0.28, EV charger growth has limited direct influence on PPLT prices. Consider diversifying investments."
2025-04-28T12:20:06.834401+00:00,PPLT,-0.1132,Weak negative correlation between EV charger growth and PPLT prices. Consider diversifying investments or further investigating other influencing factors.
2025-04-29T12:21:04.757128+00:00,PPLT,-0.28830152664663444,"The negative correlation suggests that as EV charger growth increases, PPLT prices tend to decrease. Consider diversifying with caution into metals if betting on EV growth."
2025-04-30T12:19:52.262924+00:00,PPLT,-0.02857316684892262,"The correlation between EV charger growth and PPLT prices over the last 5 months is very low, suggesting little to no linear relationship."
2025-05-01T12:19:30.536932+00:00,PPLT,-0.2607923926590568,Weak negative correlation suggests no strong relationship between EV charger growth and PPLT prices. No investment decision based solely on this correlation is recommended.
2025-05-02T12:19:59.444061+00:00,PPLT,-0.4249182927993988,"The correlation between EV charger growth and PPLT prices is moderately negative. This suggests that as EV charger growth increases, the prices of PPLT tend to decrease. Investors should be cautious and consider diversifying portfolios, especially if relying on PPLT as a proxy for EV growth."
2025-05-03T12:18:02.455965+00:00,PPLT,-0.7782039339484481,There is a strong negative correlation between EV charger growth and PPLT prices. Consider analyzing factors affecting precious metal prices in response to infrastructure changes.
